6498d01c-14c5-152c-bf86-7bd76f91ed12,522b1fe2-2e36-4cef-a667-cd4237d08b89,Spacehunter: Adventures In The Forbidden Zone,"Three women makes an emergency landing on a planet plagued with a fatal disease, but are captured by dictator Overdog. Adventurer Wolff goes there to rescue them and meets Niki, the only Earthling left from a medical expedition. Combining their talents, they try to rescue the women.",http://www.youtube.com/watch?v=z351Gqxiv8E,0,"{'alien planet', 'forbidden zone', 'waif'}",1983-05-19 17:00:00-0700
b894a9c9-d5c0-bef7-95f5-593fdc53d294,522b1fe2-2e36-4cef-a667-cd4237d08b89,Foxy Brown ,A voluptuous black woman takes a job as a high-class prostitute in order to get revenge on the mobsters who murdered her boyfriend.,http://www.youtube.com/watch?v=Cix8i0Lz6-c,0,"{'afro', 'blaxploitation', 'drug use', 'prostitution'}",1974-04-04 17:00:00-0700
b36cf120-9885-97b7-5497-468c953a356b,522b1fe2-2e36-4cef-a667-cd4237d08b89,Longest Day ,"The retelling of June 6, 1944, from the perspectives of the Germans, the US, Britain, and the Free French. Marshall Erwin Rommel, touring the defenses being established as part of the Reich's Atlantic Wall, notes to his officers that when the Allied invasion comes they must be stopped on the beach. \"For the Allies as well as the Germans, it will be the longest day\"",http://www.youtube.com/watch?v=nqFn_pM5QxU,0,"{'allied', 'normandy', 'second world war', 'soldatin', 'steel helmet', 'widerstand'}",1962-09-24 17:00:00-0700
53a4a795-c311-c428-17c5-d8877bbcf10f,d0f60aa8-54a9-4840-b70c-fe562b68842b,The Hobbit ,"Mere seconds after the events of \"Desolation\", Bilbo and Company continue to claim a mountain of treasure that was guarded long ago: But with Gandalf the Grey also facing some formidable foes of his own, the Hobbit is outmatched when the brutal army of orcs led by Azog the Defiler returns. But with other armies such as the elves and the men of Lake-Town, which are unsure to be trusted, are put to the ultimate test when Smaug's wrath, Azog's sheer strength, and Sauron's force of complete ends attack. All in all, the trusted armies have two choices: unite or die. But even worse, Bilbo gets put on a knife edge and finds himself fighting with Hobbit warfare with all of his might for his dwarf-friends, as the hope for Middle-Earth is all put in Bilbo's hands. The one \"precious\" thing to end it all.",http://www.youtube.com/watch?v=ZSzeFFsKEt4,0,"{'battle', 'corruption', 'dragon', 'dwarves', 'elves', 'epic battle', 'hobbits', 'middle-earth (tolkien)', 'orcs', 'sword and sorcery', 'unlikely friendship'}",2014-12-16 16:00:00-0800
cd41df3e-3b03-9775-9d9e-f9e79bd1d5c7,9761d3d7-7fbd-4269-9988-6cfd4e188678,Head Above Water,"Judge George (Harvey Keitel) brings his young wife, Nathalie (Cameron Diaz), to a remote island for a vacation. But while George accompanies their only neighbor -- Nathalie's childhood friend Lance (Craig Sheffer) -- on a fishing trip, Nathalie spends time with her ex, Kent (Billy Zane). When Kent ends up dead the next morning, Nathalie tries to hide the evidence before her husband gets home. After the body is found, the events of the previous night unravel, with unexpected revelations.",http://www.youtube.com/watch?v=eMNKYXlSjeE,0,"{'amnesia', 'boat', 'honeymoon', 'husband', 'remake', 'vacation'}",1996-11-06 16:00:00-0800
4adbc99d-0ec5-7ad6-e419-a758760b8a74,522b1fe2-2e36-4cef-a667-cd4237d08b89,Sweatshop,A group of friends break into an abandoned factory in order to throw a impromptu party; unaware that it is not as empty as they originally believed.,http://www.youtube.com/watch?v=N4eeC6X6E2M,0,"{'bloody violence', 'descent into madness', 'psychopathic killer', 'punk', 'suspense', 'unspeakable evil'}",2009-11-19 16:00:00-0800
5d12ee2c-010a-b242-9556-cd5d52159d37,d0f60aa8-54a9-4840-b70c-fe562b68842b,The Exterminating Angel ,The guests at an upper-class dinner party find themselves unable to leave.,http://www.youtube.com/watch?v=ERHL5nzEMmM,0,"{'dinner party', 'guest', 'upper class'}",1962-04-30 17:00:00-0700
9c7fc27d-ef7b-22be-20bd-a2da6bb5800c,9761d3d7-7fbd-4269-9988-6cfd4e188678,Armadillo,"ARMADILLO is an upfront account of growing cynicism and adrenaline addiction for young soldiers at war. Mads and Daniel are on their first mission in Helmand, Afghanistan. Their platoon is stationed in Camp Armadillo, right on the Helmand frontline, fighting tough battles against the Taliban. The soldiers are there to help the Afghan people, but as fighting gets tougher and operations increasingly hairy, Mads, Daniel and their friends become cynical, widening the gap between themselves and the Afghan civilisation. Mistrust and paranoia set in causing alienation and disillusion. Armadillo is a journey into the soldier’s mind and a unique film on the mythological story of man and war, staged in its contemporary version in Afghanistan.",http://www.youtube.com/watch?v=0DDuRraJbOg,0,"{'bullet wound', 'combat', 'danish soldier', 'denmark', 'patrol', 'rambo-parodie', 'soldier', 'taliban'}",2010-05-26 17:00:00-0700
c2b73f9c-d018-72ae-8eb7-7a9cde6c9e20,d0f60aa8-54a9-4840-b70c-fe562b68842b,Prophecy 3:Ascent ,"The conclusion to The Prophecy Trilogy. Once again, Christopher Walken returns as the Arch-Angel Gabriel. As the War in Heaven and on Earth rages on, Pyriel, the Angel of Genocide, rises to power, intending to destroy all of mankind. The only one who stands in his way is Danyael, who was born of an Angel and a woman.",http://www.youtube.com/watch?v=GJ571emq38Y,0,"{'aus dem fenster springen', 'autopsie', 'autounfall', 'engel', 'schicksal'}",2000-03-13 16:00:00-0800
2271980c-a62f-3d63-454d-bfe557c5468d,9761d3d7-7fbd-4269-9988-6cfd4e188678,The Avengers ,"When an unexpected enemy emerges and threatens global safety and security, Nick Fury, director of the international peacekeeping agency known as S.H.I.E.L.D., finds himself in need of a team to pull the world back from the brink of disaster. Spanning the globe, a daring recruitment effort begins!",http://www.youtube.com/watch?v=eOrNdBpGMv8,0,"{'aftercreditsstinger', 'agent coulson', 'alien invasion', 'avengers', 'black widow', 'captain america', 'comic', 'duringcreditsstinger', 'hawkeye', 'hulk', 'iron man', 'loki', 'marvel', 'marvel cinematic universe', 'marvel comics', 'new york', 'nick fury', 'shield', 'superhero', 'superhero team', 'thor'}",2012-05-03 17:00:00-0700
5e553bb2-acab-5189-0a39-1ba15896fa30,d0f60aa8-54a9-4840-b70c-fe562b68842b,Feast Of Love,"A meditation on love and its various incarnations, set within a community of friends in Oregon. It is described as an exploration of the magical, mysterious and sometimes painful incarnations of love.",http://www.youtube.com/watch?v=6H_fmBCS5tU,0,"{'adultery', 'coffee', 'love', 'novel', 'nudity', 'sex'}",2007-09-27 17:00:00-0700
07be11ee-fd9e-aeaa-8316-bdada57abcaa,522b1fe2-2e36-4cef-a667-cd4237d08b89,Battle Royale,"In the future, the Japanese government captures a class of ninth-grade students and forces them to kill each other under the revolutionary \"Battle Royale\" act.",http://www.youtube.com/watch?v=qMOCEF4n_zs,0,"{'battle', 'capture', 'class', 'guitar', 'matter of life and death', 'poison', 'survivor'}",2000-12-15 16:00:00-0800
4a82d23e-0b3b-8a0f-f001-420e4e0d6be7,522b1fe2-2e36-4cef-a667-cd4237d08b89,Police Academy 2: Their First Assignment ,"Officer Carey Mahoney and his cohorts have finally graduated from the Police Academy and are about to hit the streets on their first assignment. Question is, are they ready to do battle with a band of graffiti-tagging terrorists? Time will tell, but don't sell short this cheerful band of doltish boys in blue.",http://www.youtube.com/watch?v=0b3WZ2K473s,0,"{'commandant', 'handcuffs', 'investigation', 'police academy', 'police chief', 'police everyday life', 'police operation', 'spying'}",1985-03-27 16:00:00-0800
f2ee16ce-7499-e451-d7c5-f2e6d11d9a79,522b1fe2-2e36-4cef-a667-cd4237d08b89,Trick 'r Treat ,Four interwoven stories that occur on Halloween: An everyday high school principal has a secret life as a serial killer; a college virgin might have just met the one guy for her; a group of teenagers pull a mean prank; a woman who loathes the night has to contend with her holiday-obsessed husband.,http://www.youtube.com/watch?v=wUqsXvBAqRY,0,{'halloween'},2007-10-04 17:00:00-0700
00134185-aaf5-fcf9-3244-5e5fce42f4e8,9761d3d7-7fbd-4269-9988-6cfd4e188678,The Texas Chainsaw Massacre Part 2 ,"Young DJ Vantia Block is hosting a music show when two renegade hoodlums phone her and start making trouble. The situation changes rapidly as the kids drive to a passageway and get sawed to pieces by Leatherface while the shocked DJ listens the kids' screams. Local sheriff approaches Block and convinces her to play the recording made from the phone call on radio, hoping that the killers would show up.",http://www.youtube.com/watch?v=xUyEaYxTI2U,0,"{'b horror', 'chainsaw', 'gore', 'hammer', 'slasher'}",1986-08-21 17:00:00-0700
729d4e05-8924-c5fa-314f-7635b015e55f,522b1fe2-2e36-4cef-a667-cd4237d08b89,Kiss of the Tarantula,A disturbed teenage girl unleashes her pet tarantula against her \"enemies.\",http://www.youtube.com/watch?v=LDid84AQThY,0,"{'spider', 'tarantula'}",1976-04-30 17:00:00-0700
2b90b846-b81f-eb0b-4d16-5b08c20fcdb2,522b1fe2-2e36-4cef-a667-cd4237d08b89,Daredevil,"He dwells in a world of external night, but the blackness is filled with sounds and scents, tastes and textures that most cannot perceive. Although attorney Matt Murdock is blind, his other four senses function with superhuman sharpness. By day, Murdock represents the downtrodden. At night he is Daredevil, a masked vigilante stalking the dark streets of the city, a relentless avenger of justice.",http://www.youtube.com/watch?v=LmP3YFk_YHA,0,"{'blindness and impaired vision', 'duringcreditsstinger', 'hazardous waste', 'kissing in the rain', 'mob hit', 'superhero', 'voice over narration'}",2003-02-13 16:00:00-0800
b2dab5f6-76e9-fb0b-04b4-d4e47e7f68f9,d0f60aa8-54a9-4840-b70c-fe562b68842b,Rampart ,"Follows veteran police officer Dave Brown, the last of the renegade cops, as he struggles to take care of his family, and fights for his own survival.",http://www.youtube.com/watch?v=E4xlgN6QOAs,0,"{'bigotry', 'brutality', 'confession', 'district attorney', 'ethnic diversity', 'ethnic slur', 'ex wife', 'gunshot', 'homeless man', 'los angeles police department', 'n word', 'one night stand', 'police corruption', 'racial violence', 'racist cop', 'racist insult', 'road rage', 'title spoken by character'}",2011-12-09 16:00:00-0800
18980741-3cdc-b4bd-f90d-92ba574d768b,9761d3d7-7fbd-4269-9988-6cfd4e188678,Traffic ,"An exploration of the United States of America's war on drugs from multiple perspectives. For the new head of the Office of National Drug Control Policy, the war becomes personal when he discovers his well-educated daughter is abusing cocaine within their comfortable suburban home. In Mexico, a flawed, but noble policeman agrees to testify against a powerful general in league with a cartel, and in San Diego, a drug kingpin's sheltered trophy wife must learn her husband's ruthless business after he is arrested, endangering her luxurious lifestyle.",http://www.youtube.com/watch?v=6TetUbh6jrU,0,"{'addicted', 'addiction', 'drogenboß', 'drug dealer', 'drug smuggle', 'drug traffic', 'police operation', 'united states–mexico barrier', 'usa', 'war on drugs'}",2000-12-26 16:00:00-0800
174911f4-acdc-bba7-7e5f-657c82df5162,522b1fe2-2e36-4cef-a667-cd4237d08b89,Smoke,The story of the person who became the captive of surrealistic madness.,http://www.youtube.com/watch?v=KHyUwbBbrag,0,"{'dream', 'madness', 'surreal', 'surrealism'}",2007-12-09 16:00:00-0800
a7d8dc7a-38d1-0e2b-8843-a7b1be18fcdd,9761d3d7-7fbd-4269-9988-6cfd4e188678,The Haunting In Connecticut,"When the Campbell family moves to upstate Connecticut, they soon learn that their charming Victorian home has a disturbing history: not only was the house a transformed funeral parlor where inconceivable acts occurred, but the owner's clairvoyant son Jonah served as a demonic messenger, providing a gateway for spiritual entities to crossover.",http://www.youtube.com/watch?v=MRJA3lN0xCQ,0,"{'boy in peril', 'child cancer', 'cousin cousin relationship', 'crematorium', 'desecration', 'duringcreditsstinger', 'experimental cancer treatment', 'funeral home', 'funeral parlor', 'hallucination', 'haunting', 'hide and seek', 'incinerator', 'isolated house', 'mortuary', 'occult', 'oncology ward', 'reverend', 'rosary', 'told in flashback'}",2009-03-26 17:00:00-0700
2fd24f8b-5709-2cb0-510d-b311b630a1aa,522b1fe2-2e36-4cef-a667-cd4237d08b89,Spaceballs,"When the nefarious Dark Helmet hatches a plan to snatch Princess Vespa and steal her planet's air, space-bum-for-hire Lone Starr and his clueless sidekick fly to the rescue. Along the way, they meet Yogurt, who puts Lone Starr wise to the power of \"The Schwartz.\" Can he master it in time to save the day?",http://www.youtube.com/watch?v=E_QGoqMLbdM,0,"{'altar', 'android', 'comb', 'galaxy', 'jam', 'lasergun', 'magnet beam', 'nose', 'password', 'plastic surgery', 'shield', 'space battle', 'space marine', 'space mission', 'space travel', 'speed of light', 'spoof', 'swordplay', 'temple'}",1987-06-23 17:00:00-0700
40df2d43-3d04-4fed-c13f-153cfa0fa9ff,9761d3d7-7fbd-4269-9988-6cfd4e188678,Peyton Place,"Grace Metalious' once-notorious bestseller Peyton Place is given a lavish -- and necessarily toned-down -- film treatment in this deluxe 20th Century-Fox production.  Set during WWII, the film concentrates on several denizens of the outwardly respectable New England community of Peyton Place.  Top-billed Lana Turner plays shopkeeper Constance McKenzie, who tries to make up for a past indiscretion -- which resulted in her illegitimate daughter Allison (Diane Varsi) -- by adopting a chaste, prudish attitude towards all things sexual.  In spite of herself, Constance can't help but be attracted to handsome new teacher Michael Rossi (Lee Philips).  Meanwhile, the restless Allison, who'd like to be as footloose and fancy-free as the town's \"fast girl\" Betty Anderson (Terry Moore), falls sincerely in love with mixed-up mama's boy Norman Page (Russ Tamblyn).",http://www.youtube.com/watch?v=6mE98wOuyO0,0,"{'new england', 'scandal', 'small town'}",1957-12-12 16:00:00-0800
9e2e591f-9bae-8ef4-544f-c89da7f1d493,522b1fe2-2e36-4cef-a667-cd4237d08b89,Spanglish,"A woman and her daughter emigrate from Mexico for a better life in America, where they start working for a family where the patriarch is a newly celebrated chef with an insecure wife.",http://www.youtube.com/watch?v=HXkSBXrdDxs&hd=1,0,"{'biography', 'class', 'class society', 'cook', 'deceived husband', 'family''s daily life', 'hysterical wive', 'illegal immigration', 'immigrant', 'language barrier', 'language course', 'mexikanerin', 'milieu', 'mother', 'mutter-tochter-beziehung', 'parents kids relationship', 'platonic love', 'relationship problems', 'single parent', 'singles', 'united states–mexico barrier', 'upper class', 'us-amerikanerin', 'vaterfigur', 'wife husband relationship'}",2004-12-16 16:00:00-0800
8acde385-3fdf-4048-07c8-0d1aaf2166eb,9761d3d7-7fbd-4269-9988-6cfd4e188678,Speak,"Freshman high-school student Melinda (Kristen Stewart) has refused to speak ever since she called the cops on a popular summer party. With her old friends snubbing her for being a rat, and her parents (Elizabeth Perkins, D.B. Sweeney) too busy to notice her troubles, she folds into herself, trying to hide her secret: that star senior Andy (Eric Lively) raped her at the party. But Melinda does manage to find solace in her art class headed by Mr. Freeman (Steve Zahn).",http://www.youtube.com/watch?v=uSCzahFXMrs,0,"{'attraction', 'high school', 'indie', 'jugendliche', 'mute', 'rape', 'trauma', 'woman director'}",2004-01-19 16:00:00-0800
e4d336eb-3cd4-2f3e-c1f0-30444179e77c,522b1fe2-2e36-4cef-a667-cd4237d08b89,The Princess and the Warrior,"Young nurse Sissi lives a secluded life entirely devoted to her patients at Birkenhof asylum. Her first encounter with ex-soldier and drifter Bodo has a lasting impact. He causes an accident in which he provides first aid, Sissi wonders if he may be the man of her dreams. But when she finds him weeks later she is rejected, as Bodo is stuck somewhere between a traumatic past and a criminal future.",http://www.youtube.com/watch?v=KxdKBPGp0h4,0,"{'bankeinbruch', 'life-saver', 'nurse', 'romanze'}",2000-10-11 17:00:00-0700
6ed81fec-ac47-054a-3ee6-522862beaee1,d0f60aa8-54a9-4840-b70c-fe562b68842b,Incendies,"A mother's last wishes send twins Jeanne and Simon on a journey to Middle East in search of their tangled roots. Adapted from Wajdi Mouawad's acclaimed play, Incendies tells the powerful and moving tale of two young adults' voyage to the core of deep-rooted hatred, never-ending wars and enduring love.",http://www.youtube.com/watch?v=0nycksytL1A,0,"{'checkpoint', 'christian', 'interpreter', 'massacre', 'middle east', 'militia', 'muslim', 'orphanage', 'political assassination', 'prison', 'rape', 'son', 'swimming pool', 'twins', 'will'}",2010-09-16 17:00:00-0700
843e3576-fc75-0c8e-ea6e-6c4fab6860a9,9761d3d7-7fbd-4269-9988-6cfd4e188678,Sleepaway Camp ,"Slightly disturbed and painfully shy Angela Baker is sent away to summer camp with her cousin. Not long after Angela's arrival, things start to go horribly wrong for anyone with sinister or less than honorable intentions.",http://www.youtube.com/watch?v=yfZR1Lqjws4,0,"{'b horror', 'boat accident', 'decapitation', 'gore', 'head cut off', 'murder', 'serial killer', 'slasher', 'summer camp', 'surprise ending', 'water skiing'}",1983-11-17 16:00:00-0800
b208ca58-e983-9bc1-a66d-78ca2b4d0f7b,9761d3d7-7fbd-4269-9988-6cfd4e188678,Meet Me in Las Vegas ,"Chuck Redwell is a gambling cowboy who discovers that he's lucky at the roulette wheel if he holds hands with dancer Marie. However, Marie doesn't like to hold hands with him, at least not in the beginning...",http://www.youtube.com/watch?v=8wvzW95wq4c,0,{'musical'},1956-03-08 16:00:00-0800
56c1337f-40d9-e58e-b66e-f462aba42708,d0f60aa8-54a9-4840-b70c-fe562b68842b,Mortal Kombat 2 ,"A group of heroic warriors has only six days to save the planet in \"Mortal Kombat Annihilation.\" To succeed they must survive the most spectacular series of challenges any human, or god, has ever encountered as they battle an evil warlord bent on taking control of Earth. Sequel to the film \"Mortal Kombat,\" and based on the popular video game.",http://www.youtube.com/watch?v=InrQBpj__Vc,0,"{'authority', 'battle', 'fighting', 'hand to hand combat', 'martial arts', 'tournament', 'video game'}",1997-11-20 16:00:00-0800
31e486aa-12e3-398e-744e-01c8990bf835,9761d3d7-7fbd-4269-9988-6cfd4e188678,Keyhole,"Gangster and deadbeat dad, Ulysses Pick, embarks on an unusual journey through his home.",http://www.youtube.com/watch?v=axxhRAuGC5c,0,"{'gangster', 'melodrama'}",2011-09-08 17:00:00-0700
e1bdd986-3a67-531a-2387-2a51754d937a,522b1fe2-2e36-4cef-a667-cd4237d08b89,7 Mummies,"Six escaped convicts and their female hostage make a desperate run for the Mexican border, where they stumble across a lost treasure of untold wealth, and find certain death instead on the Arizona desert.",http://www.youtube.com/watch?v=7Z7Rmp4b2eU,0,{'lebende leichen'},2006-07-17 17:00:00-0700
7d9e7e8a-737a-0641-2bef-f8fe9435725b,9761d3d7-7fbd-4269-9988-6cfd4e188678,Dodge City ,"Michael Curtiz's epic Western stars Errol Flynn as Wade Hatton, a wagon master turned sheriff who tames a cow town at the end of a railroad line.",http://www.youtube.com/watch?v=zaGVr4RzOEE,0,"{'kansas', 'sheriff'}",1939-03-30 16:00:00-0800
8f8e0236-6439-ef98-fd3a-20016ace3e15,d0f60aa8-54a9-4840-b70c-fe562b68842b,Uzumaki,"In a small town in Japan, Kirie comes upon her boyfriend's father silently videotaping a snail. Later, the mans obsession with spirals becomes more and more bizarre, ending in his suicide in a washing machine which turn his body into a spiral. Soon other inhabitants become possessed with different forms of spirals.",http://www.youtube.com/watch?v=qjs1rsrTSjI,0,"{'business man', 'dying and death', 'helix', 'japan', 'laundromat', 'tod in achterbahn', 'village'}",2000-02-10 16:00:00-0800
e85620d2-dcba-ff33-c25a-4afba8cf007c,522b1fe2-2e36-4cef-a667-cd4237d08b89,The Da Vinci Code,"When the curator of the Louvre is found murdered in the famed museum's hallowed halls, Harvard professor Robert Langdon and cryptographer Sophie Neve must untangle a deadly web of deceit involving the works of Leonardo da Vinci.",http://www.youtube.com/watch?v=pE7apZzCIAA,0,"{'albino', 'christianity', 'conspiracy', 'cryptologist', 'curator', 'freemason', 'heresy', 'holy grail', 'iconography', 'katholizismus', 'louvre', 'mona lisa', 'monk', 'opus dei', 'pentagram', 'secret society', 'sekte', 'symbologist', 'tomb', 'zurich'}",2006-05-18 17:00:00-0700
11c97a51-5718-f1c2-d37a-d1a403a62954,d0f60aa8-54a9-4840-b70c-fe562b68842b,Detour,"Al Roberts, a New York nightclub pianist, hitch-hikes to Hollywood to meet his girlfriend Sue. The gambler he's riding with, Charles, unexpectedly dies. Afraid the police wouldn't believe the truth, Al takes the man's identity. In a gas station, he gives a lift to Vera, a woman that knew Charles and blackmails Al with tragic consequences.",http://www.youtube.com/watch?v=QqBPGnSXF8Q,0,"{'b-movie', 'classic noir', 'film noir', 'hitchhiker', 'poverty row film', 'travel'}",1945-11-29 16:00:00-0800
e6b57c44-fa40-c4a3-f0b0-7ea8303f91d5,9761d3d7-7fbd-4269-9988-6cfd4e188678,The Spirit of '76,"Future Americans decide to time travel to 1776 to ask the founding fathers for the solutions to their problems. A glitch in the time machine changes their destination to 1976. Still believing themselves to be in 1776, the time travellers attempt to study this \"ideal\" civilization. 70's jokes, props and stars abound.",http://www.youtube.com/watch?v=_W-sKGeGlPA,0,"{'comedy', 'scifi'}",1989-12-31 16:00:00-0800
30f17fd2-72be-6bcf-8137-c0ba36f1b378,9761d3d7-7fbd-4269-9988-6cfd4e188678,Saving Grace ,"Unexpectedly widowed, prim and proper housewife Grace Trevethyn finds herself in dire financial straits when she inherits massive debts her late husband had been accruing for years. Faced with losing her house, she decides to use her talent for horticulture and hatches a plan to grow potent marijuana which can be sold at an astronomical price, thus solving her financial crisis.",http://www.youtube.com/watch?v=-n8rHwtoEwo,0,"{'drug dealer', 'ganove', 'greenhouse', 'police', 'rauschgift'}",2000-01-23 16:00:00-0800
9fec0c0f-6056-c09f-44bb-f3c4e10b2cbb,9761d3d7-7fbd-4269-9988-6cfd4e188678,Sudden Impact ,"When a young rape victim takes justice into her own hands and becomes a serial killer, it's up to Dirty Harry Callahan, on suspension from the SFPD, to bring her to justice.",http://www.youtube.com/watch?v=DvpDP5HEZXM,0,"{'chase', 'dirty harry', 'heart', 'revitalization'}",1983-12-07 16:00:00-0800
35b0e9f6-238f-1e7c-d256-3370968cc80c,d0f60aa8-54a9-4840-b70c-fe562b68842b,Stage Door Canteen,"A young soldier on a pass in New York City visits the famed Stage Door Canteen, where famous stars of the theater and films appear and host a recreational center for servicemen during the war. The soldier meets a pretty young hostess and they enjoy the many entertainers and a growing romance",http://www.youtube.com/watch?v=V-I-2CoTmzM,0,"{'military service', 'movie starshrine', 'performance'}",1943-06-23 17:00:00-0700
262ebef4-0626-4758-d0cd-4b72ad1526a7,522b1fe2-2e36-4cef-a667-cd4237d08b89,Dancer in the Dark ,"Selma, a Czech immigrant on the verge of blindness, struggles to make ends meet for herself and her son, who has inherited the same genetic disorder and will suffer the same fate without an expensive operation. When life gets too difficult, Selma learns to cope through her love of musicals, escaping life's troubles - even if just for a moment - by dreaming up little numbers to the rhythmic beats of her surroundings.",http://www.youtube.com/watch?v=53vr9EiOH7g,0,"{'armer lehrer', 'blindness and impaired vision', 'czech', 'dance', 'dancing', 'death penalty', 'dying and death', 'eye operation', 'eyesight', 'factory', 'factory worker', 'fantasy', 'friendship', 'hereditary disease', 'hinrichtung', 'immigrant', 'individual', 'loss of eyesight', 'mord', 'naivety', 'polizeibeamter', 'raub', 'schuld und sühne', 'schulden', 'secret', 'self-abandonment', 'small town', 'usa', 'van'}",2000-09-21 17:00:00-0700
b7eff3f8-e81e-966d-83ba-b4f65f02dc45,522b1fe2-2e36-4cef-a667-cd4237d08b89,Alps (IMAX),"In 1966, John Harlin II died while attempting Europe's most difficult climb, the North Face of the Eiger in Switzerland. 40 years later, his son John Harlin III, an expert mountaineer and the editor of the American Alpine Journal, returns to attempt the same climb.",http://www.youtube.com/watch?v=3206,0,"{'alpi', 'alps', 'climbing', 'imax', 'montagna', 'mountain', 'mountain climbing', 'mountaineering', 'mountains', 'short', 'short film', 'switzerland'}",2007-03-29 17:00:00-0700
9a8c362b-aad5-e101-9a14-7f5907ee75e3,9761d3d7-7fbd-4269-9988-6cfd4e188678,Sherlock Holmes: The Spider Woman ,"Sherlock Holmes investigates a series of so-called \"pajama suicides\". He knows the female villain behind them is as cunning as Moriarty and as venomous as a spider.Based on \"The Sign of Four\" and the short stories \"The Dying Detective\", \"The Final Problem\", \"The Speckled Band\" and \"The Adventure of the Devil's Foot\".",http://www.youtube.com/watch?v=6LSHno13Lzs,0,"{'compulsive gambling', 'sherlock holmes', 'suicide'}",1944-01-20 17:00:00-0700
