52ecd744-7083-851b-61cf-03afdabd4a7d,d0f60aa8-54a9-4840-b70c-fe562b68842b,Electra Glide in Blue ,"A short Arizona motorcycle cop gets his wish and is promoted to Homicide following the mysterious murder of a hermit. He is forced to confront his illusions about himself and those around him in order to solve the case, eventually returning to solitude in the desert.",http://www.youtube.com/watch?v=fVJeflhUkos,0,{'película de culto'},1973-08-17 17:00:00-0700
23727ade-d7a8-827b-e070-4cfecec839ed,d0f60aa8-54a9-4840-b70c-fe562b68842b,Pee-wee's Big Adventure ,"The eccentric and childish Pee-wee Herman embarks on a big adventure when his beloved bicycle is stolen. Armed with information from a fortune-teller and a relentless obsession with his prized possession, Pee-wee encounters a host of odd characters and bizarre situations as he treks across the country to recover his bike.",http://www.youtube.com/watch?v=ZrzqBwuxHV8,0,"{'alamo', 'bicycle', 'calamity', 'fake psychic', 'man child', 'movie studio'}",1985-07-25 17:00:00-0700
dce71b37-620b-a9a2-3ae1-4101cc0335f8,9761d3d7-7fbd-4269-9988-6cfd4e188678,Family Plot,Lighthearted suspense film about a phony psychic/con artist and her taxi driver/private investigator boyfriend who encounter a pair of serial kidnappers while trailing a missing heir in California.,http://www.youtube.com/watch?v=W3WfnJV9Xl8,0,"{'false identity', 'fortuneteller', 'heir', 'kidnapper', 'spiritualist'}",1976-04-08 16:00:00-0800
7b588e1e-286c-1a62-32fd-84bc72f79907,9761d3d7-7fbd-4269-9988-6cfd4e188678,My Giant ,"Billy Crystal plays a Hollywood agent who stumbles upon Max, a giant living in Romania, and tries to get him into the movies.",http://www.youtube.com/watch?v=8Zu_vbdRryk,0,"{'giant', 'romania', 'tall man'}",1998-04-09 17:00:00-0700
2b1c29db-f9ca-73e0-b910-b978491790ba,d0f60aa8-54a9-4840-b70c-fe562b68842b,Edtv,Video store clerk Ed agrees to have his life filmed by a camera crew for a tv network.,http://www.youtube.com/watch?v=87hvm2PSjeE,0,"{'reality tv', 'simulated reality ', 'tv ratings', 'tv show', 'tv station', 'tv-star'}",1999-03-25 16:00:00-0800
706a4091-e7ef-7631-667e-56d4800bc280,9761d3d7-7fbd-4269-9988-6cfd4e188678,Ratatouille ,"In one of Paris' finest restaurants, Remy, a determined young rat, dreams of becoming a renowned French chef. Torn between his family's wishes and his true calling. Remy and his pal Linguini set in motion a hilarious chain of events that turns the City of Lights upside down.",http://www.youtube.com/watch?v=jOGDozdW9Yo,0,"{'brother brother relationship', 'chef', 'confidence', 'cook', 'cookbook', 'court', 'expensive restaurant', 'family', 'kitchen', 'leaving one''s family', 'mouse', 'paris', 'pixar', 'rat', 'restaurant critic', 'river', 'roof', 'spice', 'title spoken by character', 'window', 'work'}",2007-06-27 17:00:00-0700
b3e7c8a5-9097-41e1-5c3d-61237361df9b,522b1fe2-2e36-4cef-a667-cd4237d08b89,Love Wrecked,"On a Caribbean cruise, Jenny (Bynes) is marooned on a beach with her rock and roll idol. Deliriously in love with the idea of time alone with him, she manages to hide the fact that they're a stones throw away from their resort.",http://www.youtube.com/watch?v=ZlIf0VVZ0GY,0,"{'beach', 'marooned', 'resort', 'shipwreck', 'teenage crush'}",2005-10-31 16:00:00-0800
e8c16efc-416d-39dc-b063-65fe866a6a88,d0f60aa8-54a9-4840-b70c-fe562b68842b,Foxes,"A group of friends come of age in the asphalt desert of the San Fernando Valley set to a blazing soundtrack and endless drinking, drugs and sex.",http://www.youtube.com/watch?v=7J2G8OMZrrA,0,"{'alcohol', 'drugs', 'hollywood', 'prostitution', 'sex', 'teenagers'}",1980-02-28 16:00:00-0800
37a96417-a318-52ea-b7df-9737c24d7c9e,522b1fe2-2e36-4cef-a667-cd4237d08b89,Ashanti ,"Dr. Anansa Linderby is kidnapped in a medical mission in Africa by a slave trader. From this moment, her husband will do anything to recover her and to punish the bad guys, but that will be not an easy task.",http://www.youtube.com/watch?v=64VC2w62B14,0,"{'africa', 'death', 'murder', 'slave'}",1979-03-08 16:00:00-0800
c37f0514-1058-25a6-bde2-91fa24b1494c,d0f60aa8-54a9-4840-b70c-fe562b68842b,Plunkett & Macleane ,"Will Plunkett and Captain James Macleane, two men from different ends of the social spectrum in 18th-century England, enter a gentlemen's agreement: They decide to rid the aristocrats of their belongings. With Plunkett's criminal know-how and Macleane's social connections, they team up to be soon known as \"The Gentlemen Highwaymen\". But when one day these gentlemen hold up Lord Chief Justice Gibson's coach, Macleane instantly falls in love with his beautiful and cunning niece, Lady Rebecca Gibson. Unfortunately, Thief Taker General Chance, who also is quite fond of Rebecca, is getting closer and closer to getting both: The Gentlemen Highwaymen and Rebecca, who, needless to tell, don't want to get any closer to him. But Plunkett still has a thing to sort out with Chance, and his impulsiveness gets all of them in a little trouble.",http://www.youtube.com/watch?v=MH_QY6vFCDE,0,"{'eisenbahnräuber', 'gelddieb', 'robbery', 'victorian england'}",1999-01-21 16:00:00-0800
15da802f-8d99-043f-4859-3a696fb530ae,d0f60aa8-54a9-4840-b70c-fe562b68842b,Haunts,A woman haunted by psychosexual nightmares begins to believe her father is responsible for a series of scissor-murders.,http://www.youtube.com/watch?v=T-g9rcqOQ7w,0,"{'murder', 'nightmare', 'violence'}",1977-06-30 17:00:00-0700
3ec3f20b-c989-2520-7fb6-dd37e0a9ad50,d0f60aa8-54a9-4840-b70c-fe562b68842b,The Witches ,"A young boy named Luke and his grandmother go on vacation only to discover their hotel is hosting an international witch convention, where the Grand High Witch is unveiling her master plan to turn all children into mice. Will Luke fall victim to the witches' plot before he can stop them?",http://www.youtube.com/watch?v=lVXF-3Hk5rg,0,"{'bald hair', 'chocolate', 'grandmother grandson relationship', 'mouse', 'witch'}",1990-02-15 16:00:00-0800
fdc4e779-7ba4-be01-69db-45caca6eff68,522b1fe2-2e36-4cef-a667-cd4237d08b89,Bay of Angels,"A random montage of disturbing images tell a story about one summer in the lives of two teenagers who somehow find love within each other, Orso and Marie. After they realize this, they run off to a hidden island off the coast of France where they can not be bothered until Orso's hunger for danger and crime become too much for him, forcing him to return to his normal life...",http://www.youtube.com/watch?v=J5m-XiUvLgg,0,"{'france', 'montage', 'teenage girl'}",1998-06-18 17:00:00-0700
51e86ed2-f898-2683-1818-a1693d7c68c4,522b1fe2-2e36-4cef-a667-cd4237d08b89,The Italian Job ,"After being betrayed and left for dead in Italy, Charlie Croker and his team plan an elaborate gold heist against their former ally.",http://www.youtube.com/watch?v=YT9VyEbUkCo,0,"{'fast car', 'hollywood sign', 'subtitled scene', 'television news', 'television repair'}",2003-05-29 17:00:00-0700
d2c1255a-287e-5ee4-ffb1-5fb49271ea67,522b1fe2-2e36-4cef-a667-cd4237d08b89,The Burning,"A caretaker at a summer camp is burned when a prank goes tragically wrong. After several years of intensive treatment at hospital, he is released back into society, albeit missing some social skills. What follows is a bloody killing spree with the caretaker making his way back to his old stomping ground to confront one of the youths that accidently burned him.",http://www.youtube.com/watch?v=s7xOmkQ4nYU,0,"{'axe in the head', 'burned alive', 'camp', 'slasher', 'summer camp', 'woods'}",1981-05-07 17:00:00-0700
808c4c4f-521a-dd3f-64e8-2eb8489d38da,522b1fe2-2e36-4cef-a667-cd4237d08b89,Jumanji ,"When siblings Judy and Peter discover an enchanted board game that opens the door to a magical world, they unwittingly invite Alan -- an adult who's been trapped inside the game for 26 years -- into their living room. Alan's only hope for freedom is to finish the game, which proves risky as all three find themselves running from giant rhinoceroses, evil monkeys and other terrifying creatures.",http://www.youtube.com/watch?v=3LPANjHlPxo,0,"{'blockbuster', 'giant insect', 'recluse'}",1995-12-14 16:00:00-0800
a806b14f-8704-1e51-3797-4ccf5edcfbda,522b1fe2-2e36-4cef-a667-cd4237d08b89,The Mole People,"So it starts out with an archaeological team in the 50's that stumbles upon this underground civilization of a lost dynasty of sumerians, who have apparently failed to evolve over the past 5,000 years.",http://www.youtube.com/watch?v=4gbcUCC7vxQ,0,"{'archaeologist', 'creature'}",1956-11-30 16:00:00-0800
5d7b4dd0-fe5f-ac23-c579-6fdfddfed44c,522b1fe2-2e36-4cef-a667-cd4237d08b89,Four Rooms ,It's Ted the Bellhop's first night on the job...and the hotel's very unusual guests are about to place him in some outrageous predicaments. It seems that this evening's room service is serving up one unbelievable happening after another.,http://www.youtube.com/watch?v=Rieq_TR7cV0,0,"{'bet', 'ganove', 'hotel', 'hotel room', 'los angeles', 'new year''s eve', 'sperm', 'witch', 'woman director'}",1995-12-24 16:00:00-0800
852eba9d-b564-6b1f-a6ae-12259c140713,9761d3d7-7fbd-4269-9988-6cfd4e188678,Dick,"Comedy about two high school girls who wander off during a class trip to the White House and meet President Richard Nixon. They become the official dog walkers for Nixon's dog Checkers, and become his secret advisors during the Watergate scandal.",http://www.youtube.com/watch?v=-wVcSSQGpL4,0,"{'richard nixon', 'the white house', 'watergate'}",1999-08-03 17:00:00-0700
82027f51-66d6-82ae-fb2e-8b735641b2ab,9761d3d7-7fbd-4269-9988-6cfd4e188678,The Bedroom Window,"Terry is having an affair with his boss' wife Sylvia. One night after an office party they are together and Sylvia witnesses an attack on Denise from Terry's bedroom window. She doesn't want to expose their relationship and so is reluctant about talking to the police. Terry, wanting to help, gives the police the description of the attacker. He soon becomes the main suspect in the case. He then sets to find the real rapist/killer with some help from victim Denise.",http://www.youtube.com/watch?v=dP_XWJ9K5y0,0,"{'adulterous wife', 'hitchcockian'}",1987-01-15 16:00:00-0800
3fa90f84-7881-1e3e-8ca4-027da60f6914,d0f60aa8-54a9-4840-b70c-fe562b68842b,Paris Is Burning ,"Paris Is Burning is a 1990 documentary (directeor Jennie Livingston) filmed in the mid-to-late 1980s, chronicling the ball culture of New York City and the poor, African American and Latino gay and transgendered community involved in it. Many consider Paris Is Burning to be an invaluable documentary of the end of the \"Golden Age\" of New York City drag balls and exploration of queer culture",http://www.youtube.com/watch?v=UJe0RMnf4vk,0,"{'butch femme couple', 'drag', 'gay', 'gay african american', 'gay latino', 'new york city', 'reading', 'shade', 'shoplifting', 'subculture', 'transgender', 'transvestite', 'woman director'}",1990-03-12 16:00:00-0800
e9e0765c-eb73-595f-6119-c9e168ad3e70,d0f60aa8-54a9-4840-b70c-fe562b68842b,In Her Shoes,"Irresponsible party girl Maggie (Cameron Diaz) is kicked out of her father's (Ken Howard) and stepmother's (Candice Azzara) home, where she lives for free, and is taken in by her hard-working sister, Philadelphia lawyer Rose (Toni Collette). After Maggie's disruptive ways ruin her sister's love life, Rose turns her out as well. But when their grandmother, who they never knew existed, comes into their lives, the sisters face some complicated truths about themselves and their family.",http://www.youtube.com/watch?v=24_e8YBhlH8,0,"{'audition', 'beach', 'bikini', 'blame', 'bride', 'death\xa0', 'deceit', 'drunk', 'flashback', 'florida', 'grief', 'hotel', 'jew', 'lawyer', 'liar', 'love', 'money', 'newspaper', 'novel', 'party', 'rumor', 'sex', 'shoes', 'snooping', 'suicide', 'wedding', 'wine'}",2005-10-06 17:00:00-0700
681fb037-7dd3-4dfb-6f6e-7223e5117a22,d0f60aa8-54a9-4840-b70c-fe562b68842b,Maybe Baby,"Hugh Laurie (Sam) and Joely Richardson (Lucy) star as an irresistible couple who seem to have everything - good looks, successful careers, matching motorbikes and an enthusiastic love life. The only thing they lack is the one thing that they really want - a baby. Sam sets his sights on writing a successful screenplay, a comedy about a couple trying for a baby. The only problem is that Lucy is horrified at the idea and forbids him to do it. Creative fulfillment is too much for Sam to resist and meanwhile an increasingly hormonal Lucy is distracted by the attentions of the handsome Carl Phipps (James Purefoy). Sam and Lucy's love for one another, the most important thing they have, will now truly be put to the test ...",http://www.youtube.com/watch?v=l4huMPlG87I,0,"{'childlessness', 'indie', 'pregnancy'}",2000-06-01 17:00:00-0700
c671f3b1-ccd6-13a6-73b2-2e5d05b90c90,522b1fe2-2e36-4cef-a667-cd4237d08b89,Do the Right Thing,"On the hottest day of the year on a street in the Bedford-Stuyvesant section of Brooklyn, everyone's hate and bigotry smolders and builds until it explodes into violence.",http://www.youtube.com/watch?v=rAQSa0963T8,0,"{'black people', 'chaos', 'culture clash', 'geld', 'heat', 'italo-american', 'pizza', 'pizzeria', 'police brutality', 'police operation', 'punk', 'radio transmission', 'rage and hate', 'restaurant critic', 'street war', 'sun glasses'}",1989-06-29 17:00:00-0700
3c419976-ef7a-c250-bd7d-125c670b6139,d0f60aa8-54a9-4840-b70c-fe562b68842b,Dante's Peak,"Volcanologist Harry Dalton comes to the sleepy town of Dante's Peak to investigate the recent rumblings of the dormant volcano the burg is named for. Before long, his worst fears are realized when a massive eruption hits, and immediately, Harry, the mayor and the townspeople find themselves fighting for their lives amid a catastrophic nightmare.",http://www.youtube.com/watch?v=O8HNlhVbGzY,0,"{'lava', 'lovers', 'mayor', 'natural disaster', 'partnership', 'rescue', 'small town', 'volcano', 'volcanologist'}",1997-02-05 16:00:00-0800
6e270225-ac17-01e8-6547-ea5f73bd3037,d0f60aa8-54a9-4840-b70c-fe562b68842b,Passion,The rivalry between the manipulative boss of an advertising agency and her talented protégée escalates from stealing credit to public humiliation to murder.,http://www.youtube.com/watch?v=-YhHeO1BuAI,0,"{'advertising', 'agency', 'blackmail', 'boss', 'dream', 'drunk', 'humiliation', 'lesbian', 'murder', 'nudity', 'remake', 'rivalry', 'seduction', 'talent'}",2012-09-06 17:00:00-0700
ff95d37b-4703-8771-ab85-2ccc9994241e,522b1fe2-2e36-4cef-a667-cd4237d08b89,Taras Bulba ,"Set in the 16th century, this is a story about Ukraine's Cossack warriors and their campaign to defend their lands from the advancing Polish armies.",http://www.youtube.com/watch?v=fkOHSmDFDFQ,0,"{'based on book', 'cossack', 'father-son relationship', 'sword fight', 'ukraine', 'ukrainian'}",2009-04-01 17:00:00-0700
933fcfc2-2a8e-d122-a554-dc4c558769dc,9761d3d7-7fbd-4269-9988-6cfd4e188678,Minority Report,"John Anderton is a top \"Precrime\" cop in the late-21st century, when technology can predict crimes before they're committed. But Anderton becomes the quarry when another investigator targets him for a murder charge. Can Anderton find a glitch in the system and prove his innocence before it's too late?",http://www.youtube.com/watch?v=QH-6UImAP7c,0,"{'evidence', 'hologram', 'self-fulfilling prophecy'}",2002-06-19 17:00:00-0700
17405fd8-50ce-7030-c494-67d71b2be15f,522b1fe2-2e36-4cef-a667-cd4237d08b89,The Emperor's New Groove ,"Kuzco is a self-centered emperor who summons Pacha from a village and to tell him that his home will be destroyed to make room for Kuzco's new summer home. Kuzco's advisor, Yzma, tries to poison Kuzco and accidentally turns him into a llama, who accidentally ends up in Pacha's village. Pacha offers to help Kuzco if he doesn't destroy his house, and so they form an unlikely partnership.",http://www.youtube.com/watch?v=t_YjSbp5KHM,0,"{'berater', 'birthday', 'central and south america', 'emperor', 'kingdom', 'lama', 'palace'}",2000-12-08 16:00:00-0800
3b0e8a84-790d-e829-e0fc-1e49b2278d50,d0f60aa8-54a9-4840-b70c-fe562b68842b,The Answer Man ,"Twenty years ago, Arlen Faber (Jeff Daniels) wrote a book about spirituality that became wildly popular. These days, he's a curmudgeonly recluse who only enjoys the company of his chiropractor, Elizabeth (Lauren Graham). As Elizabeth's warmth starts to melt Arlen's cold heart, he comes to realize what love really means.",http://www.youtube.com/watch?v=ZrNEcJAoyFo,0,"{'bookstore', 'indie', 'recluse', 'writer'}",2009-01-17 16:00:00-0800
cb0d2e1d-7925-10f3-7b67-465864c3dc2e,d0f60aa8-54a9-4840-b70c-fe562b68842b,Fury of the Dragon,Several episodes of the 1966 TV series \"The Green Hornet\" edited together and released as a feature.,http://www.youtube.com/watch?v=EIBSZg4C49w,0,"{'kung fu', 'masked vigilante', 'tough guy', 'two man army'}",1976-10-13 17:00:00-0700
44cd2c2e-cbd5-e81a-1d28-12be6eb2ed59,d0f60aa8-54a9-4840-b70c-fe562b68842b,Messages Deleted,"A quivering voice begs to screenwriter, Joel Brandt, to pick up the phone on a message from his answering machine. Thinking it a prank, Joel deletes the message. The caller is found dead. Another caller leaves Joel a message; there is another murder...then another...then another. The killer has Joel's attention, and Joel has the attention of the police. Now the prime suspect in a series of murders, Joel discovers this psychotic killer has targeted him for a reason found within his body of work. Will Joel be able to re-write his ending, or be forced to pay the ultimate price?",http://www.youtube.com/watch?v=yQUwjSn98Rk,0,"{'answering machine', 'mystery'}",2009-02-04 16:00:00-0800
c9345e81-271b-1fa3-e369-592f6ed689aa,d0f60aa8-54a9-4840-b70c-fe562b68842b,Great Expectations ,"Miss Havisham, a wealthy spinster who wears an old wedding dress and lives in the dilapidated Satis House, asks Pip's \"Uncle Pumblechook\" (who is actually Joe's uncle) to find a boy to play with her adopted daughter Estella. Pip begins to visit Miss Havisham and Estella, with whom he falls in love,then Pip a humble orphan suddenly becomes a gentleman with the help of an unknown benefactor.",http://www.youtube.com/watch?v=Q9RUEgT9zcc,0,"{'based on novel', 'charles dickens'}",2012-11-29 16:00:00-0800
cc1b7bce-5635-1698-36f7-7d72b26c04fa,d0f60aa8-54a9-4840-b70c-fe562b68842b,Squeeze Play,The girlfriends of softball players decide to form their own team as a way of avenging their neglect.,http://www.youtube.com/watch?v=JW9-DVqlQMs,0,"{'battle', 'dancing', 'nudity', 'revenge', 'sex', 'slapstick', 'softball', 'sport'}",1979-09-23 17:00:00-0700
408660fb-521b-b790-2167-65937cc1acaa,d0f60aa8-54a9-4840-b70c-fe562b68842b,Alien,"During its return to the earth, commercial spaceship Nostromo intercepts a distress signal from a distant planet. When a three-member team of the crew discovers a chamber containing thousands of eggs on the planet, a creature inside one of the eggs attacks an explorer. The entire crew is unaware of the impending nightmare set to descend upon them when the alien parasite planted inside its unfortunate host is birthed.",http://www.youtube.com/watch?v=097uj1HjkbM,0,"{'alien', 'android', 'beheading', 'biology', 'countdown', 'cowardliness', 'dying and death', 'female protagonist', 'h. r. giger', 'parasite', 'self-destruction', 'space marine', 'space suit'}",1979-05-24 17:00:00-0700
465503a2-980f-73ed-705a-1590455ff69c,522b1fe2-2e36-4cef-a667-cd4237d08b89,Renaissance Man,"Danny DeVito plays an advertising man who is slowly sliding downhill. When he is fired from his job in Detroit, he signs up for unemployment. One day they find him a job; Teaching thinking skills to Army recruits. He arrives on base to find that there is no structure set up for the class.",http://www.youtube.com/watch?v=axB27AE4FkA,0,"{'advertising expert', 'arbeitslosigkeit', 'commercial', 'kaserne', 'schüler - lehrer konflikt', 'soldatin', 'stau', 'vietnam veteran', 'woman director'}",1994-06-02 17:00:00-0700
a9a792ed-4d43-7677-48e2-18b58d74e72b,522b1fe2-2e36-4cef-a667-cd4237d08b89,This Gun for Hire ,"Hit man, Raven, is double crossed by nightclub owner Willard Gates who acts as a middleman for a traitorous industrialist, the president of Nitro Chemical, Alvin Brewster. Travelling to Los Angeles to kill his his betrayers, Raven meets up with Ellen Graham a nightclub magician and singer who has just landed a job with Gates. Ellen's fiancée, policeman Lt. Michael Crane is on the trail of Raven.",http://www.youtube.com/watch?v=GSx-CiuC-QA,0,"{'film noir', 'hired killer'}",1942-05-12 17:00:00-0700
afa25c78-181f-6bc3-f1af-7b485a22e2d2,d0f60aa8-54a9-4840-b70c-fe562b68842b,Bowling For Columbine ,"Why do 11,000 people die in America each year at the hands of gun violence? Talking heads yelling from every TV camera blame everything from Satan to video games. But are we that much different from many other countries? What sets us apart? How have we become both the master and victim of such enormous amounts of violence? This is not a film about gun control. It is a film about the fearful heart and soul of the United States, and the 280 million Americans lucky enough to have the right to a constitutionally protected Uzi. From a look at the Columbine High School security camera tapes to the home of Oscar-winning NRA President Charlton Heston, from a young man who makes homemade napalm with The Anarchist's Cookbook to the murder of a six-year-old girl by another six-year-old, Bowling for Columbine is a journey through America, through our past, hoping to discover why our pursuit of happiness is so riddled with violence.",http://www.youtube.com/watch?v=EUSpszWfu_w,0,"{'canada', 'checks and balances', 'columbine', 'gun', 'homicide', 'national rifle association', 'oklahoma city bombing', 'person running amok', 'to shoot dead', 'usa'}",2002-10-10 17:00:00-0700
1a98ed55-f245-8b09-bb05-cdd4bee4ee49,d0f60aa8-54a9-4840-b70c-fe562b68842b,Black Dragons ,"It is prior to the commencement of World War II, and Japan's fiendish Black Dragon Society is hatching an evil plot with the Nazis. They instruct a brilliant scientist, Dr. Melcher, to travel to Japan on a secret mission. There he operates on six Japanese conspirators, transforming them to resemble six American leaders. The actual leaders are murdered and replaced with their likeness …",http://www.youtube.com/watch?v=T7XdxMIdV98,0,"{'embassy', 'nazi', 'sabotage'}",1942-03-05 17:00:00-0700
edd8de19-35f7-e614-65c0-490a9f6a09d6,d0f60aa8-54a9-4840-b70c-fe562b68842b,Midnight Crossing,A group of adventurers sneak into Cuba to try to recover $1 million in cash that when hidden when Fidel Castro took over in 1959. They find themselves trying to avoid detection by Cuban authorities while also battling modern-day pirates who are also after the treasure.,http://www.youtube.com/watch?v=oXXoQwCGq8E,0,"{'boat', 'island', 'sea', 'suspense'}",1988-05-12 17:00:00-0700
78bbd39f-01e7-66c2-7981-bf771b58313f,522b1fe2-2e36-4cef-a667-cd4237d08b89,Hitman ,"The best-selling videogame, Hitman, roars to life with both barrels blazing in this hardcore action-thriller starring Timothy Olyphant. A genetically engineered assassin with deadly aim, known only as \"Agent 47\" eliminates strategic targets for a top-secret organization. But when he's double-crossed, the hunter becomes the prey as 47 finds himself in a life-or-death game of international intrigue.",http://www.youtube.com/watch?v=XJhNzHyq-IE,0,"{'adversary', 'assassin', 'celibacy', 'geheimformel', 'gewalttätigkeit', 'government', 'hinrichtung', 'hit man', 'hitman', 'intelligence', 'killerin', 'power', 'power takeover', 'russia', 'secret identity', 'secret society', 'union of soviet socialist republics', 'videogame'}",2007-11-20 16:00:00-0800
0ba304cb-3564-b694-5cb7-80ddd2dcc0ea,9761d3d7-7fbd-4269-9988-6cfd4e188678,Drums Along the Mohawk ,"Set in America's Colonial period, John Ford's adventure tale follows Gilbert (Henry Fonda) and Lana Martin (Claudette Colbert) as they try to survive the rugged frontier. After their settlement is repeatedly attacked by Indians, the couple is taken in by a spinster (Edna May Oliver). Lana bears a son, while Gilbert heads off to fight the Indians and the British. He returns, wounded, to find his family once again under attack by the Indians.",http://www.youtube.com/watch?v=R0CtSFCjs2Y,0,"{'farm', 'frontiersman', 'newlywed'}",1939-11-02 16:00:00-0800
cc6ed94f-1ee4-d306-5918-7638e01068bc,d0f60aa8-54a9-4840-b70c-fe562b68842b,The Ultimate Gift,"When his wealthy grandfather finally dies, Jason Stevens fully expects to benefit when it comes to the reading of the will. But instead of a sizable inheritance, Jason receives a test, a series of tasks he must complete before he can get any money. Abigail Breslin and Lee Meriwether also star in this coming-of-age drama based on the novel by Jim Stovall.",http://www.youtube.com/watch?v=rwXe5eKZr6M,0,"{'grandfather grandson relationship', 'indie', 'inheritance fight', 'wealth'}",2006-10-19 17:00:00-0700
b14104c7-aa2a-a29e-5668-31baedf740e1,9761d3d7-7fbd-4269-9988-6cfd4e188678,Locked Down ,"Danny, a respected cop, is setup after an investigation goes wrong. While laying low in his new jail cell, Danny is forced to get involved in the inmates underground cage fighting circuit. With the help of Irving, a former mixed martial arts champion, Danny devises a scheme to bring justice and innocence to his family's name, if he can get out of the cage alive.",http://www.youtube.com/watch?v=B-rDlw1_upc,0,{'indie'},2010-11-08 16:00:00-0800
