1a16ad94-3cc2-f916-13ad-7299d2799051,522b1fe2-2e36-4cef-a667-cd4237d08b89,Call Northside 777,"In 1932, a cop is killed and Frank Wiecek sentenced to life. Eleven years later, a newspaper ad by Frank's mother leads Chicago reporter P.J. O'Neal to look into the case. For some time, O'Neal continues to believe Frank guilty. But when he starts to change his mind, he meets increased resistance from authorities unwilling to be proved wrong.",http://www.youtube.com/watch?v=S1PtylxhECg,0,"{'newspaper man', 'reporter'}",1948-01-31 16:00:00-0800
99aac3e6-b468-659c-9ecf-85c696ba9163,522b1fe2-2e36-4cef-a667-cd4237d08b89,Kissing on the Mouth,"Raw. Honest. Naked. \"Kissing on the Mouth\" is post-college life in close-up. Ellen is sleeping with her ex-boyfriend while trying to ignore the fact that he's looking for more than just sex. Her roommate, Patrick, isn't helping matters with his secretive and jealous behavior. The small cast served as the only crew on this intimate and humorous film featuring real interviews with recent college graduates and a documentary approach to the graphic sex and conversations.",http://www.youtube.com/watch?v=or3Fc05U3yE,0,"{'indie', 'mumblecore', 'unsimulated sex'}",2004-12-31 16:00:00-0800
5b8d83a8-c606-52de-3f94-cf21e41936bf,d0f60aa8-54a9-4840-b70c-fe562b68842b,Fatal Attraction,A married man's one night stand comes back to haunt him when that lover begins to stalk him and his family.,http://www.youtube.com/watch?v=3ZhGDxEhA6w,0,"{'affäre', 'deceived wive', 'marriage crisis', 'sexual obsession', 'star-rechtsanwalt', 'suspense', 'wife husband relationship'}",1987-09-10 17:00:00-0700
377367ce-528c-a488-b46f-9511f66779eb,522b1fe2-2e36-4cef-a667-cd4237d08b89,Melancholia,Two sisters find their already strained relationship challenged as a mysterious new planet threatens to collide with Earth.,http://www.youtube.com/watch?v=wzD0U841LRM,0,"{'destruction of planet', 'power outage', 'wedding reception', 'wedding toast'}",2011-05-25 17:00:00-0700
76555964-7a01-fd0a-3e26-7a8a8e992f9c,522b1fe2-2e36-4cef-a667-cd4237d08b89,Live,"Coldplay Live 2012 is the band's first concert film/live album for nine years. It documents their acclaimed Mylo Xyloto world tour, which was seen by more than three million people since it began in June 2011. The film was directed by Paul Dugdale, previously responsible for Adele's Live at the Royal Albert Hall and The Prodigy's Worlds On Fire concert films. Coldplay Live 2012 includes footage from Coldplay's shows at Paris's Stade de France, Montreal's Bell Centre and the band's triumphant Pyramid Stage headline performance at Glastonbury 2011.",http://www.youtube.com/watch?v=EB-NbV4JTjU,0,"{'coldplay', 'concierto', 'live concert', 'mylo xyloto'}",2012-11-18 16:00:00-0800
40328e18-e3bc-19a9-9c5e-c0746e3c63e7,522b1fe2-2e36-4cef-a667-cd4237d08b89,Model By Day ,Lady X is a woman who works during the day as a model but turns into a fighter for justice at night with the help of her karate master Chang.,http://www.youtube.com/watch?v=EG2fLPA-Ru0,0,"{'fashion', 'mafia', 'martial arts', 'model', 'tv movie'}",1993-10-09 17:00:00-0700
8819e208-2a6d-8c38-76c3-eed4bbadbfdc,d0f60aa8-54a9-4840-b70c-fe562b68842b,Tiki,"When Amy moves from her beloved Hawaiian Islands to study drama on the mainland, she has little cause to rejoice as a gang of vicious co-eds plots to make her life a living hell. With the aid of their boyfriends, the girls set Amy up as the target of a horrendous prank that results in the young girl falling victim to a brain seizure from which she may never recover. Seeking answers, her aunt Maelea arrives with a special Tiki doll -- specially designed to kill! Through magic, she coaxes Amy's subconscious spirit to enter the idol's body and bring it to hideous life. Now the idol tracks down the students one by one to exact its grisly revenge in a relentless assault of Tiki terror!",http://www.youtube.com/watch?v=aT0BquU1GRE,0,"{'boobs', 'exotic island', 'hawaii', 'killer doll', 'monster', 'violence & gore'}",2006-10-09 17:00:00-0700
74275194-a01c-155f-7264-4c1d94f7bbcc,d0f60aa8-54a9-4840-b70c-fe562b68842b,The Show ,"Truman Burbank is the star of \"The Truman Show\", a 24-hour-a-day \"reality\" TV show that broadcasts every aspect of his life -- live and in color -- without his knowledge. His entire life has been an unending soap opera for consumption by the rest of the world. And everyone he knows--including his wife and his best friend -- is really an actor, paid to be part of his life.",http://www.youtube.com/watch?v=c3gI9ms8Fdc,0,"{'claustrophobia', 'hidden camera', 'make believe', 'pretend', 'reality show'}",1998-06-03 17:00:00-0700
fe572754-f9df-aa15-5073-4e7e9407537f,522b1fe2-2e36-4cef-a667-cd4237d08b89,Escort Girl?,A woman tries to hide her job from her daughter who is returning home from boarding school.,http://www.youtube.com/watch?v=pxx-lBdarI4,0,"{'escort girl', 'escort service', 'exploitation film'}",1940-12-31 16:00:00-0800
86d5f16e-2f66-3468-a62f-b1f1ba32d29a,9761d3d7-7fbd-4269-9988-6cfd4e188678,Rent-A-Cop,"When call-girl Della gets caught in the middle of a drug bust at a hotel where she was meeting a trick, she is held hostage by a robber that busted in on the drug agents and the drug dealers. She gets rescued by vice cop Church who is accused of staging the aborted bust. Ex-ballplayer turned drug dealer Roger is in tight with corrupt vice cops and their superiors And the fireworks start popping.",http://www.youtube.com/watch?v=WB0S0CtDu-E,0,"{'independant film', 'prostitutes', 'street shootout'}",1988-01-14 16:00:00-0800
0da1266a-df30-4667-1463-bea76097da75,9761d3d7-7fbd-4269-9988-6cfd4e188678,Teenage Mutant Ninja Turtles III,"The four turtles travel back in time to the days of the legendary and deadly samurai in ancient Japan, where they train to perfect the art of becoming one. The turtles also assist a small village in an uprising.",http://www.youtube.com/watch?v=w2dNvVdz3js,0,"{'japan', 'ninjas', 'time travel'}",1993-03-16 16:00:00-0800
4f9594dc-f08a-e689-bfa0-6040c9ffa1eb,9761d3d7-7fbd-4269-9988-6cfd4e188678,Jimmy Neutron - Boy Genius,"Jimmy Neutron is a boy genius and way ahead of his friends, but when it comes to being cool, he's a little behind. All until one day when his parents, and parents all over Earth are kidnapped by aliens, it's up to him to lead all the children of the world to rescue their parents.",http://www.youtube.com/watch?v=pUVijnO5W7M,0,"{'alien', 'battle', 'boy genius', 'comicviolence', 'genius', 'gi', 'laser gun', 'miniturization', 'rescue', 'robot', 'showdown', 'spear', 'villain'}",2001-12-20 16:00:00-0800
6b4fed66-9e45-63c8-8fd7-0dd523c80dcb,9761d3d7-7fbd-4269-9988-6cfd4e188678,Cheech & Chong's The Corsican Brothers,Two brothers who can feel each others' pain and pleasure mess up the French revolution.,http://www.youtube.com/watch?v=oF5LKRNVzOQ,0,"{'clowning', 'mistaken identity', 'zwilling'}",1984-07-26 17:00:00-0700
12b9de14-750d-fce6-259d-59227a0f49fb,9761d3d7-7fbd-4269-9988-6cfd4e188678,17 Again,"On the brink of a midlife crisis, 30-something Mike O'Donnell wishes he could have a \"do-over.\" And that's exactly what he gets when he wakes up one morning to find he's 17 years old again. With his adult mind stuck inside the body of a teenager, Mike actually has the chance to reverse some decisions he wishes he'd never made. But maybe they weren't so bad after all.",http://www.youtube.com/watch?v=UQK5Hh0L1Sg,0,{'high school'},2009-03-10 17:00:00-0700
2231089b-7a50-41aa-00bf-a0fc5dbb5190,d0f60aa8-54a9-4840-b70c-fe562b68842b,The Mangler,"When an accident involving a folding machine at an old laundry happens, detective John Hunton investigates. While he tries to solve the mystery, Bill Gartley, the owner, wants to find new victims for his machine.",http://www.youtube.com/watch?v=rY7m5deuZhY,0,"{'crushed', 'living machine'}",1995-03-02 16:00:00-0800
b2f8a9eb-9f5f-b1e8-9a03-0bcd698f8912,9761d3d7-7fbd-4269-9988-6cfd4e188678,Sidewalks of New York ,"Six New Yorkers have an interrelated series of relationships. TV producer Tommy, who's just broken up with his girlfriend, has a short relationship with commitment-phobe Maria, who he meets in a video store, and also hooks up with married real-estate agent Annie, who he meets while apartment hunting. Annie is open to a relationship because her husband, Griffin, is cheating on her, which she slowly comes to realize through talking to her friend/co-worker who's gone through the same thing. Griffin, a 39-year-old dentist, is cheating with 19-year-old waitress Ashley, who he picked up in a park; she realizes she can do better when Ben, a hotel doorman and aspiring musician, tries to pick her up, in a belated attempt to recover from his divorce a year ago from schoolteacher Maria (the same Maria from the video store). Most of these relationships seem driven more by a desperate need to be in a relationship than actual love.",http://www.youtube.com/watch?v=FHVpgT0UuDg,0,{'indie'},2001-11-22 16:00:00-0800
1b76d342-fd63-2e2d-d38c-ecae91d4aa0d,d0f60aa8-54a9-4840-b70c-fe562b68842b,Down Argentine Way ,An American girl on vacation in Argentina falls for a wealthy racehorse owner.,http://www.youtube.com/watch?v=11Uq0it1x9g,0,{'argentina'},1940-10-10 16:00:00-0800
cb5f79bf-d80c-77a7-69e2-7c160fdad876,9761d3d7-7fbd-4269-9988-6cfd4e188678,Rambo: First Blood,"Col. Troutman recruits ex-Green Beret John Rambo for a highly secret and dangerous mission. Teamed with freedom fighter Co Bao, Rambo goes deep into Vietnam to rescue POWs. Deserted by his own team, he's left in a hostile jungle to fight for his life, avenge the death of a woman and bring corrupt officials to justice.",http://www.youtube.com/watch?v=s3nblhkrHG0,0,"{'agentin', 'chase', 'denunziation', 'liberation', 'liberation of prisoners', 'machinegun', 'photography', 'prisoner', 'prisoner of war', 'prisoner of war camp', 'rache', 'soldatin', 'submachine gun', 'urwald', 'us-army', 'us-regierung', 'usa', 'vietnam', 'vietnam veteran', 'vietnam war', 'war'}",1985-05-20 17:00:00-0700
b5e017fc-433e-0fe0-c5e0-97106533a321,d0f60aa8-54a9-4840-b70c-fe562b68842b,Shall We Dance? ,"A romantic comedy where a bored, overworked Estate Lawyer, upon first sight of a beautiful instructor, signs up for ballroom dancing lessons.",http://www.youtube.com/watch?v=UGtS3CL-zpo,0,"{'dancing master', 'jealousy', 'wife husband relationship'}",2004-10-14 17:00:00-0700
98b62317-fdf6-34f4-2746-a69603bae51d,d0f60aa8-54a9-4840-b70c-fe562b68842b,Fly Away Home,"Amy is only 13 years old when her mother is killed. She goes to Canada to live with her father, an eccentric inventor whom she barely knows. Amy is miserable in her new life... until she discovers a nest of goose eggs that were abandoned when a local forest is torn down. The eggs hatch and Amy becomes \"Mama Goose\". When Winter comes, Amy, and her dad must find a way to lead the birds South...",http://www.youtube.com/watch?v=KxEK8xHyAnc,0,"{'aviation', 'canada', 'daughter', 'earring', 'ecology', 'goose', 'hang glider', 'inventor', 'loss of mother', 'rescue', 'shampoo', 'tragedy'}",1996-09-12 17:00:00-0700
1f527660-2bcb-570e-2df3-2ce84986c312,522b1fe2-2e36-4cef-a667-cd4237d08b89,Moonstruck ,"Cher is devastatingly funny, sinuous and beautiful as Loretta, an unlucky-in-love Italian widow who finds romance through the intervention of the Manhattan moon. With her wedding to a close friend just weeks away, she meets - and falls hopelessly in love with - his younger brother (Cage)!",http://www.youtube.com/watch?v=FtvJexR4iVg,0,"{'full moon', 'love letter', 'lover', 'new york'}",1987-12-17 16:00:00-0800
f6a9562f-098b-c61c-35c5-7285ce87e81f,522b1fe2-2e36-4cef-a667-cd4237d08b89,Happily N'Ever After ,"An alliance of evil-doers, led by Frieda, looks to take over Fairy Tale Land. But when Ella realizes her stepmother is out to ruin her storybook existence, she takes a dramatic turn and blossoms into the leader of the resistance effort.",http://www.youtube.com/watch?v=wHM6fNDKdu4,0,"{'bad mother-in-law', 'cinderella', 'dwarves', 'fairy tale', 'gut und böse', 'little red riding hood', 'praktikant', 'prinz', 'rapunzel', 'rumpelstilzchen', 'sleeping beauty', 'step mother', 'wizardry', 'wolf', 'woman director'}",2006-09-13 17:00:00-0700
2dc42dd4-9a68-c57e-dc12-ad76579948ab,522b1fe2-2e36-4cef-a667-cd4237d08b89,Christmas Story,"The comic mishaps and adventures of a young boy named Ralph, trying to convince his parents, teachers, and Santa that a Red Ryder B.B. gun really is the perfect Christmas gift for the 1940s.",http://www.youtube.com/watch?v=uvMLfSQrHKE,0,"{'bb gun', 'christmas tree dealer', 'dog stealing food', 'holiday', 'mall santa', 'nostalgia', 'pink bunny', 'tongue stuck on a pole', '\xa0essay'}",1983-11-17 16:00:00-0800
cfd34396-faeb-c44c-ad61-c73abb6f037c,9761d3d7-7fbd-4269-9988-6cfd4e188678,Sgt. Bilko ,The army is known for churning out lean mean fighting machines intent on protecting our great nation. Martin is the inexplicable the incorrigible the invicible sgt. Ernie bilko leader of a ragtag group of the sorriest soldiers ever to enlist in the armed forces.,http://www.youtube.com/watch?v=lnymWvGgVUw,0,"{'based on tv series', 'gulf war', 'military spoof', 'us-army'}",1996-03-28 16:00:00-0800
a276ea6b-c9d7-d37c-8c89-137b971754ac,9761d3d7-7fbd-4269-9988-6cfd4e188678,Welcome to the Rileys ,"Years after their teenage daughter’s death, Lois and Doug Riley, an upstanding Indiana couple, are frozen by estranging grief. Doug escapes to New Orleans on a business trip. Compelled by urgencies he doesn’t understand, he insinuates himself into the life of an underage hooker, becoming her platonic guardian.",http://www.youtube.com/watch?v=HlSPOzQG-Uk,0,"{'hooker', 'indie', 'sex with underaged', 'smoking marijuana', 'stripper', 'teenage girl'}",2010-10-28 17:00:00-0700
01c7c422-23a7-7ba2-8087-f7d62c313b8b,522b1fe2-2e36-4cef-a667-cd4237d08b89,Play It to the Bone,"Two aging fighters in LA, friends, get a call from a Vegas promoter because his undercard fighters for a Mike Tyson bout that night are suddenly unavailable. He wants them to box each other. They agree as long as the winner gets a shot at the middleweight title. They enlist Grace, Cesar's current and Vinnie's ex girlfriend, to drive them to Vegas.",http://www.youtube.com/watch?v=ovju_D3QB5Y,0,{'sports film'},1999-12-24 16:00:00-0800
74bc1cd0-e3e7-7815-6916-e931b0b613ec,522b1fe2-2e36-4cef-a667-cd4237d08b89,Barfly,"Downtrodden writer Henry and distressed goddess Wanda aren't exactly husband and wife: they're wedded to their bar stools. But they like each other's company- and Barfly captures their giddy, gin-soaked attempts to make a go of life on the skids.",http://www.youtube.com/watch?v=SrpTDaSjfaM,0,"{'alcohol abuse', 'alcoholism', 'bartender', 'career', 'indie'}",1987-09-01 17:00:00-0700
45301aff-baa6-c5d1-1b84-46d104ee723c,522b1fe2-2e36-4cef-a667-cd4237d08b89,The Mummy's Hand ,"A couple of comical, out-of-work archaeologists in Egypt discover evidence of the burial place of the ancient Egyptian princess Ananka. After receiving funding from an eccentric magician and his beautiful daughter, they set out into the desert only to be terrorized by a sinister high priest and the living mummy Kharis who are the guardians of Ananka's tomb.",http://www.youtube.com/watch?v=3TFII0hWa1U,0,{'mummy'},1940-09-19 16:00:00-0800
7dcb216a-12bf-537c-0a4a-912be8edc6de,522b1fe2-2e36-4cef-a667-cd4237d08b89,Manhunter,"FBI Agent Will Graham, who retired after catching Hannibal Lecktor, returns to duty to engage in a risky cat-and-mouse game with Lecktor to capture a new killer. This film is based on the novel \"Red Dragon\" and predates all the later films with Anthony Hopkins as Hannibal Lecter (which also spells Lecter's name correctly).",http://www.youtube.com/watch?v=czVMfUd5dFI,0,"{'covered investigation', 'eye', 'fbi agent', 'full moon', 'investigation', 'loss of family', 'psychopath', 'psychoterror', 'serial killer'}",1986-08-13 17:00:00-0700
ad99f0b1-dfad-0bcc-07be-34b84bcbd195,9761d3d7-7fbd-4269-9988-6cfd4e188678,Hannie Caulder ,Hannie enlists the aid of bounty hunter Tom Price to teach her how to be a gunfighter so she can hunt down the 3 men who killed her husband and raped her.,http://www.youtube.com/watch?v=hjkifyQ4NiU,0,"{'rape revenge', 'spaghetti western'}",1971-11-07 16:00:00-0800
326a41ab-a16c-5951-e03e-7cbd75dccff1,9761d3d7-7fbd-4269-9988-6cfd4e188678,Marked Man ,"Frank, an auto mechanic, witnesses the love of his life's demise at the hands of a drunk driver. Frank lets lose his rage, and kills the man. He then goes to prison, where he is framed for the murder of a fellow inmate. Frank sees escape as the only possible way to find out all the answers in the convoluted plot to kill that inmate, and find the proof to convict the true killers.",http://www.youtube.com/watch?v=Uk2BC9fA_I8,0,"{'framed', 'hunted', 'murder'}",1995-12-31 16:00:00-0800
03775e8f-3bf1-aab9-4bca-28cf679255d0,9761d3d7-7fbd-4269-9988-6cfd4e188678,Made In Heaven,"A romantic, occasionally funny, drama about two souls who consummate their marriage literally in \"Heaven\". Mike Shea, in his first life dies as a young man performing a heroic rescue. Shortly after arriving in \"Heaven\" he meets a new soul, Annie Packert, who has never lived on Earth before. The drama centers around their separation soon after being wedded and the burning question is whether they will reunite on Earth before time runs out or whether they are fated to eternal soul-searching.",http://www.youtube.com/watch?v=JGLu15SJ1no,0,{'heaven'},1987-11-05 16:00:00-0800
6542812a-b039-2ea9-7e46-4abf67691637,d0f60aa8-54a9-4840-b70c-fe562b68842b,The Color Purple ,"In the southern United States in the 1930s, a male-dominated African American woman fights her way through a troubled life.",http://www.youtube.com/watch?v=d83NnlL83mc,0,"{'adoption', 'africa', 'black people', 'empowerment', 'inzest', 'jazz', 'jazz musician', 'letter', 'prison', 'rape', 'sister sister relationship', 'southern u.s.', 'violent father', 'violent husband'}",1985-12-17 16:00:00-0800
603255b8-524b-551e-ef40-70fbb7ab48f1,522b1fe2-2e36-4cef-a667-cd4237d08b89,The AristoCats,"When Madame Adelaide Bonfamille leaves her fortune to Duchess and her children -- Bonfamille's prize family of domesticated house cats -- the butler plots to steal the money and kidnaps the heirs, leaving them out on a country road. All seems lost until the wily Thomas O'Malley Cat and his jazz-playing alley cats come to the Aristocats's rescue.",http://www.youtube.com/watch?v=223bYlLJSnU,0,"{'aussetzung', 'butler', 'cat', 'erbe', 'music', 'paris', 'return'}",1970-12-23 16:00:00-0800
8e684fb5-93fe-482a-05ee-34544f37d3e8,9761d3d7-7fbd-4269-9988-6cfd4e188678,Deja Vu,"Called in to recover evidence in the aftermath of a horrific explosion on a New Orleans ferry, Federal agent Doug Carlin gets pulled away from the scene and taken to a top-secret government lab that uses a time-shifting surveillance device to help prevent crime. But can it help Carlin change the past? Hold on to your seat for an explosive and intriguing thrill ride you'll want to experience again and again.",http://www.youtube.com/watch?v=uxdS8TP37I4,0,"{'deja vu', 'fbi-agent', 'investigator', 'new orleans', 'time travel'}",2006-11-20 16:00:00-0800
10407c74-8a1d-0a9a-65d3-0db1afd441fb,522b1fe2-2e36-4cef-a667-cd4237d08b89,Shinobi: Heart Under Blade,"Even though Gennosuke and Oboro are from rival ninja villages, they are secretly in love. At an annual conference with the Lord, it is dictated that a competition--a fight to the death--will take place between the five best shinobi from each village. Gennosuke and Oboro's love is made even more impossible when they each got picked as the leader of the five to represent their respective villages.",http://www.youtube.com/watch?v=9JH7qjyesSc,0,"{'forbidden love', 'japan', 'ninja fighter'}",2005-09-16 17:00:00-0700
1eff14c0-434c-8f08-df1b-46671e441f3b,522b1fe2-2e36-4cef-a667-cd4237d08b89,Mr. 3000 ,"Aging baseball star who goes by the nickname, Mr. 3000, finds out many years after retirement that he didn't quite reach 3,000 hits. Now at age 47 he's back to try and reach that goal.",http://www.youtube.com/watch?v=-EQobqroFY8,0,"{'baseball', 'sports film'}",2004-09-16 17:00:00-0700
c906c4e9-5380-3d5c-2390-a839d7af4252,9761d3d7-7fbd-4269-9988-6cfd4e188678,No Way Out ,"Joaquin (Polo Ravales), an unassuming fisherman, is forced to confront his homosexuality when his sex-starved wife Cynthia (Althea Vega) returns from her overseas job eager to get pregnant. His young and impulsive lover, Waldo (Joseph Bitangcol), flees to Manila in disgust. After a month of hesitation, Joaquin leaves his wife to follow Waldo. His search takes him on a seamy yet colorful trip through Manila's gay underbelly. He discovers Waldo's dangerous flirtation with Rufo (Emilio Garcia), a bisexual rogue cop who holds the clue to Waldo's disappearance. Rufo lures Joaquin into his home and introduces him to his submissive wife, Beng (Jean Garcia). A sadist who beats up Beng regularly, Rufo turns Joaquin into a prisoner and sex slave - like he did to Waldo. When Joaquin is finally reunited with Waldo, he discovers that Rufo is about to sell them like fish to an international sex trafficking ring, along with his personal harem of male and female captives.",http://www.youtube.com/watch?v=vaniOIVplOI,0,{'gay'},2008-12-10 16:00:00-0800
c1e8f60e-5fc7-8086-666f-4153c5b3e7f5,9761d3d7-7fbd-4269-9988-6cfd4e188678,Every Breath,An unemployed actor gets involved with a strange woman who hangs out in lesbian nightclubs and her rich arms dealer husband.,http://www.youtube.com/watch?v=c2tIrWwtWWc,0,"{'female nudity', 'lesbianism', 'murder', 'night club'}",1994-03-29 16:00:00-0800
31ef100e-bb89-be39-72da-8043d68b2166,d0f60aa8-54a9-4840-b70c-fe562b68842b,Galaxy Invader,An alien is hunted by a gang of drunken hillbillies who saw him crash-land his spaceship.,http://www.youtube.com/watch?v=geK_EvPFzao,0,"{'alien', 'bar', 'hillbilly', 'hunting', 'redneck'}",1985-03-31 16:00:00-0800
afbb715b-7eff-0313-211f-c61dc55142ac,522b1fe2-2e36-4cef-a667-cd4237d08b89,Alien³ ,"During its return to the earth, commercial spaceship Nostromo intercepts a distress signal from a distant planet. When a three-member team of the crew discovers a chamber containing thousands of eggs on the planet, a creature inside one of the eggs attacks an explorer. The entire crew is unaware of the impending nightmare set to descend upon them when the alien parasite planted inside its unfortunate host is birthed.",http://www.youtube.com/watch?v=097uj1HjkbM,0,"{'alien', 'android', 'beheading', 'biology', 'countdown', 'cowardliness', 'dying and death', 'female protagonist', 'h. r. giger', 'parasite', 'self-destruction', 'space marine', 'space suit'}",1979-05-24 17:00:00-0700
6083be67-8a8d-5fe8-37fd-707739a0ac13,9761d3d7-7fbd-4269-9988-6cfd4e188678,Secret Defense,"In France, terrorist groups and intelligence agencies battle in a merciless war everyday, in the name of radically opposed ideologies. Yet, terrorist and secret agents lead almost the same lives. Condemned to secrecy, these masters of manipulation follow the same methods. Alex and Al Barad are two of them. The former is the head of the D.G.S.E.'s (Direction Générale de la Sécurité Extérieure, the French equivalent of the CIA or the MI6) counter-terrorism unit while the latter reigns over a terrorist network, and both fight using the most ruthless of weapons: human beings.",http://www.youtube.com/watch?v=8b6P8A_4lQU,0,"{'intelligence agency', 'suspense', 'terrorist'}",2008-12-09 16:00:00-0800
d5764d11-0079-2efa-eb04-3e04b7b2de0e,d0f60aa8-54a9-4840-b70c-fe562b68842b,Octopussy,James Bond is sent to investigate after a fellow “00” agent is found dead with a priceless Farberge egg. James bond follows the mystery and uncovers a smuggling scandal and a Russian General who wants to provoke a new World War.,http://www.youtube.com/watch?v=IwHbCvXMbS8,0,"{'atomic bomb', 'crocodile', 'east-berlin', 'eastern block', 'hot air balloon', 'james bond', 'kgb', 'secret intelligence service', 'snake charmer'}",1983-06-04 17:00:00-0700
7f4555d4-5c52-e4e6-d3bf-25b1a3811fff,522b1fe2-2e36-4cef-a667-cd4237d08b89,Police Academy 2: Their First Assignment,"Officer Carey Mahoney and his cohorts have finally graduated from the Police Academy and are about to hit the streets on their first assignment. Question is, are they ready to do battle with a band of graffiti-tagging terrorists? Time will tell, but don't sell short this cheerful band of doltish boys in blue.",http://www.youtube.com/watch?v=0b3WZ2K473s,0,"{'commandant', 'handcuffs', 'investigation', 'police academy', 'police chief', 'police everyday life', 'police operation', 'spying'}",1985-03-27 16:00:00-0800
404c8b8e-78ed-f2da-912d-03988532834a,522b1fe2-2e36-4cef-a667-cd4237d08b89,Ashes,2013／HD／Color／31min／,http://www.youtube.com/watch?v=HBrjvGhxcfU,0,{'police'},2014-05-10 17:00:00-0700
19e370cf-ed6d-6bb7-ae83-e52d105b6069,9761d3d7-7fbd-4269-9988-6cfd4e188678,Nine 1/2 Weeks,"An erotic story about a woman, the assistant of an art gallery, who gets involved in an impersonal affair with a man. She barely knows about his life, only about the sex games they play, so the relationship begins to get complicated.",http://www.youtube.com/watch?v=oRCRpEDyFuU,0,"{'broker', 'gallery owner', 'prostitute', 'sadomasochism', 'sexual obsession', 'women''s sexual identity'}",1986-02-13 16:00:00-0800
a573a5cd-105c-5534-d73d-038d9504ad86,d0f60aa8-54a9-4840-b70c-fe562b68842b,The Tartars,A barbarian army attacks Viking settlements along the Russian steppes.,http://www.youtube.com/watch?v=3mBshjN1uCw,0,{'viking'},1961-08-17 17:00:00-0700
3346be61-6771-b761-d77d-697a82a0c43b,522b1fe2-2e36-4cef-a667-cd4237d08b89,Christmas Evil,A psycho in a Santa suit gets to decide who's been naughty and who's been nice.,http://www.youtube.com/watch?v=_uAMtjDXXhs,0,"{'christmas horror', 'killer', 'santa claus'}",1980-10-31 16:00:00-0800
